{
  "feature": "demo-pay",
  "generated_at": "2026-09-16T10:45:00Z",
  "template": {
    "id": "测试用例-模板",
    "version": "3.32.0"
  },
  "feature_name": "演示支付",
  "module": "pay",
  "author": "王五",
  "date": "2026-09-16",
  "version": "v1.0",
  "credentials": [
    {
      "item": "用户名",
      "value_ref": "admin",
      "source_file": "backend/pay/src/main/resources/db/migration/postgresql/V1.0.2__seed_admin_user.sql",
      "line": "24"
    },
    {
      "item": "密码",
      "value_ref": "从 seed 读取 BCrypt 密文比对（不记录明文）",
      "source_file": "backend/pay/src/main/java/com/demo/pay/config/SeedInitializer.java",
      "line": "31"
    }
  ],
  "cases": [
    {
      "id": "TC-demo-pay-001",
      "name": "新增支付单成功",
      "priority": "P0",
      "type": "功能",
      "acceptance_refs": [
        "M-01-F01-A01"
      ],
      "precondition": "1. 已用 admin 登录系统 2. 已进入支付模块",
      "steps": [
        {
          "action": "点击「新增支付单」",
          "expected": "弹出表单"
        },
        {
          "action": "填写 order_no 与 amount 后保存",
          "expected": "保存成功并返回支付单 ID"
        }
      ],
      "data": [
        {
          "field": "order_no",
          "value": "RF2026091600001",
          "source": "手动输入"
        }
      ],
      "result": {
        "executed": true,
        "date": "2026-09-16",
        "executor": "王五",
        "status": "PASS",
        "defect": ""
      }
    },
    {
      "id": "TC-demo-pay-002",
      "name": "amount 为 0 时创建被拒绝",
      "priority": "P1",
      "type": "边界",
      "acceptance_refs": [
        "M-01-F01-A02"
      ],
      "precondition": "1. 已用 admin 登录系统",
      "steps": [
        {
          "action": "新增支付单 amount 填 0",
          "expected": "提示金额必须大于 0，创建失败"
        }
      ],
      "result": {
        "executed": true,
        "date": "2026-09-16",
        "executor": "王五",
        "status": "PASS",
        "defect": ""
      }
    },
    {
      "id": "TC-demo-pay-003",
      "name": "关闭已支付支付单返回 409",
      "priority": "P0",
      "type": "异常",
      "acceptance_refs": [
        "M-01-F02-A01"
      ],
      "precondition": "1. 存在一张已支付支付单",
      "steps": [
        {
          "action": "调用 close 接口关闭已支付支付单",
          "expected": "返回 409，状态保持已支付"
        }
      ],
      "result": {
        "executed": true,
        "date": "2026-09-16",
        "executor": "王五",
        "status": "PASS",
        "defect": ""
      }
    }
  ],
  "defects": [],
  "signoffs": [
    {
      "role": "测试工程师",
      "name": "王五",
      "date": "2026-09-16"
    },
    {
      "role": "开发负责人",
      "name": "张三",
      "date": "2026-09-16"
    }
  ],
  "zero_results": [
    {
      "path": "defects",
      "reason": "首轮执行全部通过，无缺陷"
    }
  ]
}